{
  "site": {
    "name": "みどり野マルシェ（商品情報なしの確認）",
    "url": "https://example.com",
    "description": "items.display を書かないとき（既定の none）、商品がどこにも出ないことを確認するための設定。データには商品が入ったままで、掲載だけを止めている。"
  },
  "event": { "year": 2026, "venue": "みどり野中央公園", "hours": "10:00-16:00" },
  "days": [
    { "id": "day1", "date": "2026-10-03", "label": "10月3日(土)", "shortLabel": "3日(土)" },
    { "id": "day2", "date": "2026-10-04", "label": "10月4日(日)", "shortLabel": "4日(日)" }
  ],
  "pricing": {
    "mode": "currency",
    "currency": { "unit": "円", "position": "suffix", "grouping": true, "decimals": 0 },
    "note": "税込"
  },
  "locale": "ja",
  "timezone": "Asia/Tokyo",
  "announcements": { "source": "data/news.json", "visibleCount": 2 }
}
